{
  "$schema": "./schemas/audio.schema.json",
  "schemaVersion": "1.0.0",
  "version": "1.0.0",
  "engineId": "web-audio-synth-v1",
  "cues": {
    "recruit": {
      "group": "sfx",
      "voices": [
        { "freq": 520, "dur": 0.12, "wave": "triangle", "gain": 0.1, "slide": 0 },
        { "freq": 780, "dur": 0.15, "wave": "triangle", "gain": 0.07, "slide": 0 }
      ]
    },
    "place": {
      "group": "sfx",
      "voices": [
        { "freq": 300, "dur": 0.08, "wave": "square", "gain": 0.05, "slide": 0 }
      ]
    },
    "merge": {
      "group": "sfx",
      "voices": [
        { "freq": 440, "dur": 0.1, "wave": "triangle", "gain": 0.1, "slide": 440 }
      ]
    },
    "hero": {
      "group": "sfx",
      "voices": [
        { "freq": 523, "dur": 0.15, "wave": "triangle", "gain": 0.12, "slide": 0 },
        { "freq": 659, "dur": 0.2, "wave": "triangle", "gain": 0.1, "slide": 0 },
        { "freq": 784, "dur": 0.3, "wave": "triangle", "gain": 0.1, "slide": 0 }
      ]
    },
    "fail": {
      "group": "sfx",
      "voices": [
        { "freq": 180, "dur": 0.15, "wave": "sawtooth", "gain": 0.05, "slide": -80 }
      ]
    },
    "ult": {
      "group": "sfx",
      "voices": [
        { "freq": 220, "dur": 0.4, "wave": "sawtooth", "gain": 0.08, "slide": -120 }
      ]
    }
  },
  "eventMap": {
    "recruit_result": "recruit",
    "deploy": "place",
    "merge": "merge",
    "hero_unlock": "hero",
    "hero_cast": "ult",
    "invalid_action": "fail"
  },
  "bgm": []
}
